{
  "$schema": "https://json-schema.org/draft-07/schema",
  "title": "Cosmos Wallet",
  "description": "Cosmos Wallet.json is a metadata file that contains information about a wallet of a specific platform and which chains it supports, either natively or via custom client-side addition.",
  "type": "object",
  "properties": {
    "$schema": {
      "type": "string"
    },
    "wallet_name": {
      "type": "string",
      "pattern": "[a-z]+"
    },
    "pretty_name": {
      "type": "string"
    },
    "website": {
      "type": "string",
      "format": "url"
    },
    "git_repo": {
      "type": "string",
      "format": "url"
    },
    "supported_chains": {
      "type": "array",
      "items": {
        "type": "string",
        "pattern": "[a-z0-9]+"
      },
      "minContains": 1
    },
    "features": {
      "type": "array",
      "items": {
        "type": "string",
        "enum": [
          "suggest_chain",
          "get_supported_chains",
          "icns"
        ]
      }
    },
    "platforms": {
      "type": "array",
      "items": {
        "type": "object",
        "properties": {
          "device": {
            "type": "string",
            "enum": [
              "mobile",
              "tablet",
              "desktop",
              "other"
            ]
          },
          "type": {
            "type": "string",
            "enum": [
              "application",
              "extension"
            ]
          },
          "platform": {
            "type": "string",
            "enum": [
              "chrome",
              "firefox",
              "ios",
              "android",
              "otherOS",
              "otherBrowser"
            ]
          },
          "install_link": {
            "type": "string",
            "format": "uri"
          }
        },
        "additionalProperties": false,
        "required": [
          "device",
          "type",
          "platform"
        ]
      },
      "minContains": 1
    }
  },
  "additionalProperties": false,
  "required": [
    "$schema",
    "wallet_name",
    "pretty_name",
    "platforms",
    "supported_chains"
  ]
}