{
  "$schema": "../wallet.schema.json",
  "wallet_name": "leapmobile",
  "pretty_name": "Leap cosmos",
  "website": "https://leapwallet.io",
  "git_repo": "",
  "supported_chains": [
    "cosmoshub",
    "juno",
    "osmosis",
    "akash",
    "assetmantle",
    "axelar",
    "cheqd",
    "chihuahua",
    "desmos",
    "emoney",
    "fetchhub",
    "gravitybridge",
    "injective",
    "irisnet",
    "jackal",
    "kujira",
    "likecoin",
    "persistence",
    "atlantic",
    "sifchain",
    "sommelier",
    "stargaze",
    "starname",
    "stride",
    "teritori",
    "umee"
  ],
  "platforms": [
    {
      "device": "mobile",
      "type": "application",
      "platform": "ios",
      "install_link": "https://apps.apple.com/in/app/leap-cosmos/id1642465549"
    },
    {
      "device": "mobile",
      "type": "application",
      "platform": "android",
      "install_link": "https://play.google.com/store/apps/details?id=io.leapwallet.cosmos"
    }
  ]
}
