{
  "$schema": "../wallet.schema.json",
  "wallet_name": "cosmostationextention",
  "pretty_name": "Cosmostation",
  "website": "https://www.cosmostation.io/",
  "git_repo": "https://github.com/cosmostation/cosmostation-chrome-extension",
  "supported_chains": [
      "cosmoshub",
      "akash",
      "assetmantle",
      "axelar",
      "bandchain",
      "bitcanna",
      "bitsong",
      "canto",
      "cerberus",
      "chihuahua",
      "comdex",
      "coreum",
      "crescent",
      "cryptoorgchain",
      "cudos",
      "desmos",
      "emoney",
      "evmos",
      "fetchhub",
      "gravitybridge",
      "injective",
      "irisnet",
      "impacthub",
      "juno",
      "kava",
      "kichain",
      "konstellation",
      "kujira",
      "kyve",
      "likecoin",
      "lumnetwork",
      "neutron",
      "noble",
      "nyx",
      "omniflixhub",
      "onomy",
      "osmosis",
      "panacea",
      "passage",
      "persistence",
      "provenance",
      "quasar",
      "regen",
      "rizon",
      "secretnetwork",
      "sentinel",
      "shentu",
      "sifchain",
      "sommelier",
      "stafihub",
      "stargaze",
      "starname",
      "stride",
      "teritori",
      "tgrade",
      "umee"
  ],
  "features": [
    "suggest_chain",
    "icns"
  ],
  "platforms": [
    {
      "device": "desktop",
      "type": "extension",
      "platform": "chrome",
      "install_link": "https://chrome.google.com/webstore/detail/cosmostation/fpkhgmpbidmiogeglndfbkegfdlnajnf?utm_source=chrome-ntp-icon"
    }
  ]
}
